{
  "ok": true,
  "command": "schedule.related_task.create",
  "response_contract": "spine.schedule-related-task-create-response.v1",
  "effect": "related_task_schedule_created",
  "command_id": "related-task-pack-golf-bag",
  "command_receipt_id": "receipt-related-task-pack-golf-bag",
  "audit_id": "audit-related-task-pack-golf-bag",
  "task": {
    "item_id": "task-pack-golf-bag",
    "current_version": "1",
    "task_status": "open",
    "title": "Pack golf bag",
    "subject_roles": [{ "subject_id": "subject-owner", "role": "assignee", "status": "active" }]
  },
  "source": {
    "item_id": "event-golf-trip",
    "target_version": "1",
    "scope": "item",
    "source_target_version": "1",
    "source_anchor_id": "anchor-golf-start",
    "source_scheduled_fact": "2026-08-22T10:00:00",
    "resolved_source_utc": "2026-08-22T14:00:00Z",
    "timezone": "America/Toronto",
    "timezone_database_version": "2026c"
  },
  "relationship": {
    "relation_id": "relation-pack-part-of-golf",
    "relation_type": "part_of",
    "source_item_id": "task-pack-golf-bag",
    "target_item_id": "event-golf-trip",
    "status": "active"
  },
  "temporal_binding": {
    "temporal_binding_id": "binding-pack-golf",
    "binding_contract": "spine.relative-temporal-binding.v1",
    "target_item_id": "task-pack-golf-bag",
    "target_anchor_role": "task_due",
    "source_item_id": "event-golf-trip",
    "source_anchor_role": "event_start",
    "relationship_id": "relation-pack-part-of-golf",
    "binding_mode": "snapshot",
    "source_terminal_behavior": null,
    "created_by_command_id": "related-task-pack-golf-bag",
    "created_by_subject_id": "subject-owner",
    "created_at_utc": "2026-08-17T11:30:00Z",
    "binding_status": "active",
    "latest_revision": {
      "temporal_binding_revision_id": "binding-revision-pack-golf-1",
      "temporal_binding_id": "binding-pack-golf",
      "revision_index": "1",
      "source_target_version": "1",
      "source_scope": "item",
      "source_anchor_id": "anchor-golf-start",
      "source_recurrence_revision_id": null,
      "source_occurrence_key": null,
      "source_occurrence_selector_ref": null,
      "source_occurrence_provenance_id": null,
      "source_scheduled_fact": "2026-08-22T10:00:00",
      "offset_basis": "elapsed",
      "offset_seconds": "-86400",
      "resolved_source_utc": "2026-08-22T14:00:00Z",
      "resolved_target_utc": "2026-08-21T14:00:00Z",
      "target_local_date": "2026-08-21",
      "target_local_time": "10:00:00",
      "target_timezone": "America/Toronto",
      "target_timezone_database_version": "2026c",
      "target_item_version": "1",
      "target_anchor_id": "anchor-pack-due",
      "resolution_kind": "initial",
      "normalized_temporal_binding_revision_hash": "aaaaaaaaaaaaaaaaaaaaaaaaaaaaaaaaaaaaaaaaaaaaaaaaaaaaaaaaaaaaaaaa",
      "created_by_command_id": "related-task-pack-golf-bag",
      "created_at_utc": "2026-08-17T11:30:00Z"
    },
    "binding_state": "snapshot_resolved"
  },
  "scheduled_time": {
    "anchor_id": "anchor-pack-due",
    "anchor_role": "task_due",
    "local_date": "2026-08-21",
    "local_time": "10:00:00",
    "timezone": "America/Toronto",
    "timezone_database_version": "2026c",
    "utc_instant": "2026-08-21T14:00:00Z"
  },
  "delivery": null,
  "policies": [],
  "materialization": {
    "mode": "none",
    "state": "not_requested",
    "opportunity_count": "0",
    "work_instance_count": "0",
    "opportunity_work": [],
    "work_instance_ids": []
  },
  "work_instance_ids": [],
  "phases": {
    "task": "authored",
    "relation": "authored",
    "binding": "resolved",
    "policies": "none",
    "opportunities": "not_requested",
    "work": "not_requested",
    "delivery": "not_attempted"
  },
  "delivery_state": "not_attempted_by_command",
  "receipt": {
    "receipt_contract": "spine.schedule-related-task-create-receipt.v1",
    "command_receipt_id": "receipt-related-task-pack-golf-bag",
    "effect": "related_task_schedule_created",
    "semantic_facts_hash": "bbbbbbbbbbbbbbbbbbbbbbbbbbbbbbbbbbbbbbbbbbbbbbbbbbbbbbbbbbbbbbbb",
    "created_at_utc": "2026-08-17T11:30:00Z"
  }
}
